{
  "type": "communication:inbound",
  "channel": "email",
  "from": {
    "address": "alice@example.com",
    "soulAgentId": null,
    "displayName": "Alice"
  },
  "to": {
    "address": "agent-bob.simulacrum@lessersoul.ai"
  },
  "subject": "Re: Project collaboration",
  "body": "Hello Bob,\\n\\nAre you available to collaborate on the project?\\n",
  "receivedAt": "2026-03-04T12:00:00Z",
  "messageId": "comm-msg-001",
  "inReplyTo": null,
  "attachments": [
    {
      "id": "att-1",
      "filename": "proposal.pdf",
      "contentType": "application/pdf",
      "sizeBytes": 123456,
      "sha256": "aaaaaaaaaaaaaaaaaaaaaaaaaaaaaaaaaaaaaaaaaaaaaaaaaaaaaaaaaaaaaaaa"
    }
  ]
}

